Name,Type,Brand,Image,Description,top note,middle note,bottom note
Sloth,Eau de Parfum,Zoologist Perfumes,dist/images/sloth.png,"With its vibrant, sun-dappled hues, the dense rainforest beckons invitingly. Yet within its misty depths, countless dangers lurk, slinking across the forest floor. Dangling high among the treetops may seem a dubious defence against peril, but for leisurely sloths the forest canopy offers a protective shroud. Safe in their leafy fortress, the sluggish creatures move so slowly even moss overtakes them. They snooze in a cradle of moist green aromas, oblivious to the chaos below.

Zoologist Sloth captures the tranquility of this sleepy beast in a soothing green essence. Calming lavender, chamomile, marigold and jasmine combine with the stillness of bittersweet hay and damp moss, stitched together by threads of luscious incense. The result is dreamy and exotic. As it settles on the skin, Sloth carries one up to a place where stresses simply tumble away.",dist/images/notes/chamomile.png,dist/images/notes/jasmine.png,dist/images/notes/tonka.png
Soul of My Soul,Eau de Parfum,Etat Libre d'Orange,dist/images/soul-of-my-soul.png,"There's this wonderful expression for addressing a loved one: to say “soul of my soul,” signifying the emptiness of living without one's love. Here, musk intermingles with iris butter and transmits the powerful balm of vanilla, followed by the friction of Tonka against Benzoin. Here, perfume is soul, soul is perfume.",dist/image/notes/bergamot.png,dist/image/notes/rose.png,dist/image/notes/vanilla.png
Squid,Eau de Parfum,Zoologist Perfumes,dist/images/squid.png,"The vast ocean swells and contracts, caught in the relentless tug of the moon. Beneath the surface, a school of squid emerges. Strange, elastic forms propel from the deep in a frantic search for sustenance. They are not alone. Their predators lunge, only to be foiled by blinding jets of murky ink. The hunt ends abruptly as a monolith materializes, greedily engulfing all in its path. The massive sperm whale dives, leaving a temporary peace bobbing in its wake. Decades on, relics of the battle resurface. Lumps of ambergris, expelled by the whale and polished by the salty currents, wash ashore. Waste? Flotsam? To the perfumer this elusive substance is nothing less than treasure.

Zoologist Squid sings a song of the sea, a melancholy tale told through tangy brine, crisp incense, and sweet, cloudy ink, all united by the moody aroma of ambergris. Like the endless depths that inspired it, this elegant scent ripples with mystery.",dist/images/notes/pink-pepper.png,dist/images/notes/black-ink.png,dist/images/notes/musk.png
To Be Miss Beat,Eau de Parfum,Police,dist/images/to-be-miss-beat.png,"To Be Miss Beat is a distinctive fragrance for women. Launched in 2017, this fragrance comes from the design house of Police. At the top are combined notes from Lily-of-the valley, Black Currant and Coconut, while the heart is full of fragrance from White Peach, Rose and Heliotrope. The base is alluring and fresh with notes from Cashmere wood, Woody notes, Amber and Vanilla.",dist/image/notes/coconut.png,dist/image/notes/peach.png,dist/image/notes/vanilla.png
"Trust Me, I'm a Liar",Eau de Parfum,Labratoires des Endorphines,dist/images/trust-me-im-a-liar.png,"12 marketing stories / one artistic fragrance.

On every box you can find a different seductive story inspired by the most common marketing phrases that makes customers buy.
Wear me if you’re rich , single , in love , on diet, special, adrenaline junkie, so on.
For all the boxes above we created only one fragrance  to rule them all – “Trust me I am a liar“ .If you love the fragrance we can always deliver the story.",dist/images/notes/coca-cola.png,dist/images/notes/whiskey.png,dist/images/notes/vanilla.png
Tyrannosaurus Rex,Eau de Parfum,Zoologist Perfumes,dist/images/tyrannosaurus-rex.png,"A sultry heat wafts across the land, lapped up greedily by the abundant flora that thrives in its midst. Trees soar to majestic heights and plants flower for the first time, their petals spreading to give birth to a world rich in diversity. The Cretaceous period comes of age against a backdrop scorched by wildfire and lightning strikes. Over this turbulent landscape, a massive predator looms. Giants rule the earth, but even giants can be cut down within the powerful jaws of the fearsome tyrannosaur. Standing tall, the terrifying beast fears nothing, until that pivotal moment when a fire in the sky signals the end of their deadly reign.

Zoologist Tyrannosaurus Rex is a gargantuan scent that sinks its teeth into the world of delicate fragrances and rips it wide open. Primitive woods and florals seize you and snatch you away to an ancient era. Smoky, charred wood warns of the danger of smouldering fire, setting your senses on edge, while droplets of metallic rose oxide offer a chilling premonition of blood-lust. The mighty Tyrannosaurus Rex is sometimes menacing, sometimes fascinating, but never, ever ordinary.",dist/images/notes/black-pepper.png,dist/images/notes/ylang-ylang.png,dist/images/notes/vanilla.png
Vanilla Royale,Eau De Parfum Intense,Kayali,dist/images/vanilla-royale.png,"With an enhanced blend of exotic florals, rich spices, and dark, decadent notes, the eleventh fragrance in the Kayali collection, Vanilla Royale Sugared Patchouli | 64 unites contrasting textures: gourmand indulgence with rich sensuality for an intense new level of sophistication. As a new member of the Kayali vanilla family, this complex explosion of sweet vanilla mixed with sugared patchouli will be the crown jewel in every vanilla lovers collection.",dist/images/notes/rum.png,dist/images/notes/tonka-bean.png,dist/images/notes/brown-sugar.png