Name,Type,Brand,Image,Description,top note,middle note,bottom note
Bee,Eau de Parfum,Zoologist Perfumes,dist/images/bee.png,"The spring day seems still and peaceful. Yet beneath the wildly splattered canvas of a blossom-strewn meadow, thousands engage in a desperate race for survival. Worker bees toil at a frantic pace, ferrying a precious cargo of nectar and pollen to deposit it within cramped honeycomb cells, where it will nurture drones and larvae under the eye of a regal queen. In the claustrophobic hive, a deafening buzz offers evidence of the bees' devotion to duty, not a single worker pausing to question its role in perpetual grind of life in the queendom.

Like the frantic hustle of the bee through a maze of multi-faceted scents, Zoologist Bee delivers a surreal experience. The rich aroma of honey captivates, while alluring florals, royal jelly, animalic beeswax and regal incense unite to create a buzz, offering excitement, and the sweet rewards of life.",dist/images/notes/orange.png,dist/images/notes/mimosa.png,dist/images/notes/tonka.png
Chameleon,Eau de Parfum,Zoologist Perfumes,dist/images/chameleon.png,"Like the luminescent skin of a reptile, fiery scales of sunlight ripple across the surface of the Indian Ocean, fading slowly to gold and finally sapphire as the sun sinks and disappears. The sea exhales, its gentle tide caressing the beach of an island paradise. The salty breath combines with the narcotic aromas of the ylang and frangipani trees in an intimate kiss, sending shivers through the branches. Something stirs – an eye pivots, a tail grips a slender bough. Will the creature vanish among the leaves, or flirt with a daring display of colour? No one knows. The secrets that lie beneath the skin of the chameleon keep Madagascar guessing.",dist/images/notes/ylang-ylang.png,dist/images/notes/saffron.png,dist/images/notes/vanilla.png
Cherries,Eau de Parfum,Oriflame,dist/images/cherries.png,"Cherries is the smell of sweet temptations from the cherry fruit, which is hard to resist. This delicious floral - fruity perfume is composed of juicy red fruits, rich and sparkling, intoxicating bouquet of pink freesia, magnolia and jasmine, packed in a beautifully-shaped bottles in the form of three cherries. 
",dist/images/notes/cherry.png,dist/images/notes/jasmine.png,dist/images/notes/musk.png
Cow,Eau de Parfum,Zoologist Perfumes,dist/images/cow.png,"Lush green pastures tumble toward the horizon, arching beneath the imposing silhouette of a mountain range. Cumulus clouds roll across a bright blue sky, their massive shadows gliding over a peacefully grazing herd. In a corner of the meadow, a tiny calf braces quivering limbs and, with a mighty lurch, stumbles up to take its maiden steps. Its velvet snout prods, rooting at its mother, until the release of warm milk signals a satisfying welcome to this vast new world.

Zoologist Cow brings to mind a bucolic scene, a myriad of scents from Mother Nature’s nurturing bosom. Innocent florals sway among soft grasses, while apple gently sweetens the soft aroma of fresh milk. The result is a place both familiar and reassuring, where warm arms unfold to welcome us into a loving embrace. A place called home.",dist/images/notes/apple.png,dist/images/notes/milk.png,dist/images/notes/cedarwood.png
Dangerous Complicity,Eau de Parfum,Etat Libre d'Orange,dist/images/dangerous-complicity.png,"The scent of skin on skin as Inspired by Adam and Eve eating the forbidden fruit, and in doing so, complicity took on another dimension and became dangerous. An aphrodisiac rush of ginger and rum runs through a fleshly apricot cheek and the lost innocence of Jasmine and Osmanthus, warmed by cashmere wood.

Once the aphrodisiac rush of ginger and rum burns through, Dangerous Complicity unveils this passionate pact between fruit, flower and flesh.

This is the scent of skin on skin — or should that be sin on skin? — intimate and sexy, edgy but smooth as a swans-down powder puff. The scent of leather and powder, or rather: the softly scented trace a bad boy’s leather jacket would leave on the powdered skin of a femme fatale. The masculine yielding to the feminine in a fragrant folie à deux - or is it the other way round?",dist/images/notes/jasmine.png,dist/images/notes/rum.png,dist/images/notes/sandalwood.png
Dark Lord,Eau de Parfum,Kilian,dist/images/dark-lord.png,"Dark Lord ""Ex Tenebris Lux' is a gentleman of the night. Meet him in the most surprising of circumstances and his mystery slowly unfolds: A head-twisting mix of shadows and light, it seduces in seconds with its elegant, long-lasting accords of leather and strong vetiver, its jasmine drenched in rum, and a dandyish entrance of bergamot and pepper. Under lock and tasseled key, a 1.7 oz. flacon is carved with the Achilles’ Shield as a symbol of protection and finished with monogram-engraved gunmetal details. A smiling skull rises like a monument atop a black lacquered wooden coffret, illuminating a display of grim magnificence.",dist/images/notes/pepper.png,dist/images/notes/rum.png,dist/images/notes/leather.png
Death and Decay,Eau de Parfum,Lush,dist/images/death-and-decay.png,"A loving, reverent study of pure, sweet lilies and funereal silences. Notes of ylang ylang, rose and jasmine are serene and poignant on the skin, yet ultimately uplifting with time. The message is one of meditation, acceptance and optimism delivered in a glorious, floral flourish.",dist/images/notes/lily.png,dist/images/notes/ylang-ylang.png,dist/images/notes/jasmine.png
Desire,Eau de Toilette,Alfred Dunhill,dist/images/desire.png,"Dunhill Desire for a Man is a perfume introduced in 2000, in the beginning of the new millennium. With its very red bottle this brand tries to attract attention of the customers, namely new generation from 25 to 45. It is addressed to self-confident and the men who want to be in the center of attention. The Desire perfume opens with the notes of apple, orange blossoms, fresh, sweet bergamot and sparkling lemon. The heart brings notes of rose, patchouli and teakwood in. The base acts with the accords of vanilla, musk and labdanum. With its attractive and modern design, Dunhill Desire is made of ruby-red glass which conquests with its woody-oriental composition. It was designed by Michael Almairac.",dist/image/notes/,dist/image/notes/,dist/image/notes/
Dodo,Eau de Parfum,Zoologist Perfumes,dist/images/dodo.png,"The sun sparkled across rippling waves, its morning dance upon the Indian Ocean rousing the dodos from their carefree slumber. Stumbling drunkenly across the forest floor they feasted on overripe fruit where it lay, dropped for them by the lush island paradise that nurtured them. For generations, the predator-free and bountiful shores lulled them into such a state of complacency that their wings grew idle, and flight was lost – even to memory. Ultimately evolution would betray them, but while it lasted, the dodos enjoyed an existence marked by ease and comfort.

In Zoologist Dodo, fragrant herbs and ferns are spiked with an invigorating splash of bergamot, juicy pineapple and blackcurrant, before the fruity aroma stumbles into a more traditional fougère. Spices frolic among notes of lavender, tonka and oakmoss, and settle down with beautiful woody undertones of oak. Dodo is a paradox. Like those extinct inhabitants of Mauritius, the scent is at once classic but fun, unknowable but impossibly unforgettable. The ideal perfume for those with an eclectic sensibility who crave a life of leisure and contentment.",dist/images/notes/pink-pepper.png,dist/images/notes/pineapple.png,dist/images/notes/tonka.png
Dragonfly,Eau de Parfum,Zoologist Perfumes,dist/images/dragonfly.png,"Giant lotus pads part to make way for buds that pierce the surface of the jade green pond. They raise their faces to the sun, their delicate fragrance floating around them. In the shadow of the flowers, tiny dragonfly nymphs also emerge from the shallows. They spread their fragile wings and shyly take flight, ready to explore a world beyond the water. Shimmering pools of nearby golden rice fields call to the dragonflies. Their long, quivering bodies flit across the cascading terraces to alight upon swaying stalks, sparkling with sunlight caught in droplets on iridescent wings.

Like a lotus spreading its petals, Zoologist Dragonfly opens with a rush of beautiful aquatic florals. Hints of rice, powdery iris, and mimosa diffuse from within a lush shroud of green, beneath the intimate aroma of an imminent summer shower. Dragonfly encapsulates the richness and romance of impressionism, a canvas of florals under a watery veil.

",dist/images/notes/grapefruit.png,dist/images/notes/violet.png,dist/images/notes/vetiver.png
Empress,Eau De Parfum Intense,Soki London,dist/images/empress.png,"Empress is housed in a faceted lilac gemstone with an ethereal presence. The luminous glass bottle is emblematic of opulent treasures found in the temples of Egypt or Morocco: the provenance of jasmine and rose oils which form the heart notes of Empress. The guiding star cap, is a nod to the wonderment of our galaxy and the celestial origins of the Empress herself, will stand with pride and beauty in your home.",dist/images/notes/strawberry.png,dist/images/notes/rose.png,dist/images/notes/toffee.png
Fame,Eau de Toilette,Paco Rabanne,dist/images/fame.png,"FAME, the covetable new feminine fragrance by Paco Rabanne. Capturing the irresistible Parisian spirit of the Rabanne woman, FAME pays tribute to a new era of femininity. Playful. sensual. empowered. the quintessence of avant-garde luxury, the fragrance is a blend of exceptionally pure jasmine, succulent mango and an addictively sensual creamy incense.",dist/images/notes/mango.png,dist/images/notes/jasmine.png,dist/images/notes/vanilla.png
Flora Gorgeous Jasmine,Eau de Parfum,Gucci,dist/images/flora-gorgeous-jasmine.png,"Gucci Flora Gorgeous Jasmine Eau de Parfrum bursts with a radiant composition led by Grandiflorum Jasmine. Tender wreaths of noble Jasmine are transformed through extraction into the heart and spirit of Gucci Flora Gorgeous Jasmine, resulting in an enlightened expression of this precious flower. Blended with base notes of Sandalwood and Benzoin, its sensual notes create a skin imprint unique to the wearer. Its energy of inner joy is further lifted with notes of Mandarine Essence and Magnolia Accord, which infuse the scent with a joyful feeling. Reimagined in Alessandro Michele’s vision, the House’s distinctive Flora pattern seals the design with a magical touch, fortifying Gucci Flora Gorgeous Jasmine as an object of inspiration.

Encased within a new, elongated bottle, crafted from lacquered turquoise stone glass featuring a shiny gold cap. The packaging features a new take on the House’s distinctive Flora pattern, first created by artist and illustrator Vittorio Accornero for Gucci in 1966.",dist/images/notes/mandarin.png,dist/images/notes/jasmine.png,dist/images/notes/sandalwood.png
Funeral Home,Eau de Cologne,Demeter,dist/images/funeral-home.png,"Funeral Home is a blend of classic white flowers including lilies, carnations, gladiolus, chrysanthemums with stems and leaves, with a hint of mahogany and oriental carpet.",dist/images/notes/lily.png,dist/images/notes/carnation.png,dist/images/notes/grass.png
Gabrielle,Eau de Parfum,Chanel,dist/images/gabrielle.png,"The most precious and sensual interpretation of GABRIELLE CHANEL. Striking from the first drop, it is worn directly on the skin to feel the full intensity of its floral power. In its square, thin-walled bottle, the fragrance seems to levitate. The box, the cover and the label are tinted with a deep gold. For the first time, CHANEL is presenting a bottle of Extrait topped with a spray that allows precise perfuming for an intensely feminine trail.",dist/images/notes/jasmine.png,dist/images/notes/vanilla.png,dist/images/notes/sandalwood.png
Good Fortune,Eau de Parfum, Viktor & Rolf,dist/images/good-fortune.png,"Inspired by the Spiritual Glamour Haute Couture Collection, Good Fortune is the incarnation of a new positive lifestyle, an olfactive manifesto for spirituality and self-potentialization, bringing you the power to create your own destiny.

Bewitching and powerful, the fragrance opens with the secret alchemy of the fennel & gentian flower co-distillated as an enlivening magnetic top. A Jasmine Superinfusion then takes center stage at the heart of the fragrance blooming with its velvety solar notes, while a creamy and captivating Bourbon Vanilla, ethically sourced in Madagascar, quietly sits at the base.",dist/images/notes/gentiana.png,dist/images/notes/jasmine.png,dist/images/notes/vanilla.png
I am Trash,Eau de Parfum,Etat Libre d'Orange,dist/images/i-am-trash.png,"Created in partnership with the award-winning creative network Ogilvy Paris, ‘I Am Trash’ (or in French Les Fleurs Du Dechet) is the first luxury perfume created by Upcycling; by using the trashed ingredients to create something truly beautiful. More specifically, by using exhausted Rose petals, already distilled Sandalwood chips, and even leftover Apples from the food industry to create the most beautiful fruity, floral, and woody blend.",dist/image/notes/strawberry.png,dist/image/notes/orange.png,dist/image/notes/cedarwood.png
In Love With Everything,Eau de Parfum,Imaginary Authors,dist/images/inlove.png,"Written in 1982, this electrifying novel about sex, drugs, and decadence in pre-Miami Vice Florida, follows a delinquent clique of teenage girls through nightclubs, roller discos, and seedy South Beach bars in search of anything to keep the party going. Driven by an inexhaustible enthusiasm, the girls navigate a series of potentially dangerous situations with naive ease, radiating their infectious light like a disco ball and turning even the darkest circumstances into a dance party. Lauded for its unflinchingly honest portrayal of strong, outspoken, resourceful young women whose sole motivation was to have a good time, the book stands in stark contrast to the male chauvinism of the era and still resonates today. Critics have called it “an essential examination of the joys of recklessness” and “an addictive story in which every sentence glistens with sticky sweet summer heat.”",dist/images/notes/tropical-punch.png,dist/images/notes/coco-palm-sugar.png,dist/images/notes/sandalwood.png
Inexcusable Evil,Eau de Parfum,Toskovat,dist/images/inexcusable-evil.png,"Today I remembered destruction. The pain of life often makes me forget the more disgusting pain of having it taken.

Fallen buildings on the news, crying babies, burnt flowers.

Memories lost, tears drowned, coffees never shared…

At least I have iodine on my wounds and crutches left to use, but what about those that don’t?

The next war will decide not what is right, but what is left.

Hate all governments & love all people.",dist/images/notes/gunpowder.png,dist/images/notes/blood.png,dist/images/notes/rain.png
Koala,Eau de Parfum,Zoologist Perfumes,dist/images/koala.png,"A cloak of rich green velvet sweeps across the Australian horizon, the majestic eucalypt forest flattering every curve of the undulating landscape. Tucked high in the crook of a tree, the koala is oblivious to the mesmerizing views. It would rather curl into a ball and sleep off a feast of oily eucalyptus, the aromatic leaves that sustain it. Despite their sleepy demeanour and friendly expression, koalas are territorial creatures. Males mark the soaring trunks with their musk, establishing their dominance.

Zoologist Koala opens with an invigorating blend of lemony honey and the sweet aroma of eucalyptus. They float above a blanket of black tea and spices, then draw you even deeper into musky amber and woods. The result is a unique and carefree scent that snuggles in around you, enveloping you in an embrace both playful and independent.",dist/images/notes/eucalyptus.png,dist/images/notes/vetiver.png,dist/images/notes/sandalwood.png
La Belle Fleur Terrible,Eau de Parfum Legere,Jean Paul Gaultier,dist/images/la-belle-fleur-terrible.png,"Can you keep a secret?

In the Garden of Gaultier lies a hidden corner of paradise and pleasure reserved for women, in limited edition. Shh! Here in the heart of lush nature lives the new nymph, La Belle Fleur Terrible, wearing nothing but a necklace of embroidered petals around her neck. Myth or pure fantasy?

See for yourself under the blue sky of its colourful metal tin adorned with birds and roses. Its sensual lagoon-blue bottle plunges the senses into an aquatic amber floral eau de parfum that's incredibly aphrodisiacal and light.

There you go. You’re already succumbing to its charms.",dist/images/notes/water-lily.png,dist/images/notes/iris.png,dist/images/notes/vanilla.png
La Nuit de Bohème,Eau de Parfum,Anna Sui,dist/images/la-nuit-de-boheme.png,"La Nuit de Bohème is an oriental-floral composition, announced a deep, mysterious and attractive. It begins with notes of Calabrian bergamot, mandarin, blackberry and forbidden apple. The heart flourishes with black rose, orange blossom, night blooming jasmine, magnolia and plum. The base includes patchouli, sandalwood, amber and musk.

The face of the perfume is Gracie van Gastel. The fragrance is available in bottles of 30, 50 and 75 ml Eau de Parfum.",dist/images/notes/mandarin.png,dist/images/notes/plum.png,dist/images/notes/amber.png
Lady Vengeance,Eau de Parfum,Juliette Has a Gun,dist/images/lady-vengeance.png,"She is bold and edgy, confident and divinely sensual. Lady Vengeance brings a rich and sophisticated trail with the expression of undeniable femininity. The achingly elegant but thorny Bulgarian rose marries dark patchouli and succulent vanilla to draw a fine line of elegance, contemporary and inevitable. 
",dist/images/notes/bergamot.png,dist/images/notes/rose.png,dist/images/notes/vanilla.png
Lail,Eau de Parfum,109 Parfum,dist/images/lail.png,"LAIL from the independent fragrance house 109 PARFUMS recognizes the healing power of the mighty honey. Derived from ancient Iraqi beekeeping traditions, LAIL links honey and beeswax with notes like incense, oud, patchouli and benzoin. The name, meaning night in Arabic, echoes the scent where the gore of a smoky darkness is encapsulated in sweet gooey notes.

",dist/image/notes/honey.png,dist/image/notes/vanilla.png,dist/image/notes/musk.png
Libre Le Parfum,Eau de Parfum,Yves Saint Laurent,dist/images/libre-le-parfum.png,"With an enhanced blend of exotic florals, rich spices, and dark, decadent notes, the eleventh fragrance in the Kayali collection, Vanilla Royale Sugared Patchouli | 64 unites contrasting textures: gourmand indulgence with rich sensuality for an intense new level of sophistication. As a new member of the Kayali vanilla family, this complex explosion of sweet vanilla mixed with sugared patchouli will be the crown jewel in every vanilla lovers collection.",dist/images/notes/saffron.png,dist/images/notes/lavender.png,dist/images/notes/tonka-bean.png
Macaque,Eau de Parfum,Zoologist Perfumes,dist/images/macaque,"Against the backdrop of a mountainous terrain, two communities share a peaceful coexistence. Yet despite their proximity, the societies are distinctly unique. Macaques cavort among the trees, grasping with delight at nature’s bountiful pleasures. From the quiet solemnity of a nearby temple, their human neighbours regard them, coveting the monkeys’ playful abandon. The macaques are all but oblivious, sparing only the briefest of curious glances at the pensive faces below before surrendering once again to their carefree revels.

Sweet notes of yuzu dance through a pine forest, welcoming you to Zoologist Macaque. Incense adds gravity with aromas of Hinoki woods and myrrh. The delicate balance between heavy and light results in an austere woody scent with mild hints of creamy sandalwood. Macaque is exuberance tempered by calm, sublimity buoyed by joy, a happy harmony of meditative bliss.",dist/images/notes/yuzu.png,dist/images/notes/myrrh.png,dist/images/notes/sandalwood.png
Memoirs of a Trespasser,Eau de Parfum,Imaginary Authors,dist/images/memoirs-of-a-trespasser.png,"The early exploration writing of Philip Sava bent the limits of post-modern fiction, revealing fantastical worlds that fooled many into believing they were, in fact, real. Sava’s kaleidoscopic collections, of which Memoirs of a Trespasser is the undeniable centerpiece, drew upon true experiences from his exotic travels but were infused with a hallucinatory inventiveness that set his work apart from others in the genre.
Though Sava had associates all over the world, he spent most of his time living in solitude on a ranch in southern Madagascar. When interrogated by the press on his cloistered lifestyle he notoriously answered, “Who needs love when there is still cognac in the glass?”",dist/images/notes/vanilla.png,dist/images/notes/myrrh.png,dist/images/notes/oak.png
Moth,Eau de Parfum,Zoologist Perfumes,dist/images/moth.png,"Their days are spent secluded in camouflage, the intricate pattern of their wings disguising them against a coarse backdrop of barks and rocks. When they finally stir, even their flight is concealed, shrouded beneath the cover of night. Moonlight ripples off a delicate coating of tiny hairs as their feathered antennae guide them in their search for a mate. Only one temptation can lure them from their quest. Should they succumb to the attraction of the flame, their urge to procreate may be quashed in a wisp of smoke and a smattering of ashes.

At first encounter, the rich, gothic scent of Zoologist Moth may surprise but soon it hypnotizes. A heavy dose of dark spices jolts your senses before settling into a dusting of honey-sweet rose and powdery florals. Slowly, it tests its wings, taking flight on an exotic journey of nagarmotha, guaiac wood and patchouli. Beneath it all lingers a smoky undertone that serves as a constant reminder of the danger within the tantalizing flame.",dist/images/notes/pepper.png,dist/images/notes/jasmine.png,dist/images/notes/honey.png
No Limit$ Super Fre$h,Eau de Toilette,Philipp Plein,dist/images/no-limits-super-fresh.png,"No Limit$ Super Fre$h is an intense, warm and woody fragrance for men. This strong and masculine scent is great for any day and occasion but mostly for the cold days of the year.
The perfume composition of Philipp Plein No Limit$ Super Fre$h is incredibly rich and diverse. In the top scent we feel fresh and sweet notes. They include a fruity scent of black currant, artemisia, awakening sea notes, fig and delicate lavender. The heart hides very fresh citrusy notes of grapefruit, bergamot and ginger and also spices like black pepper and cardamom. The base notes include a woody scent of sandal and cedar wood, fragrant leather, delicious scent of vanilla and white chocolate and also musk and amber.",dist/images/notes/black-currant.png,dist/images/notes/cardamom.png,dist/images/notes/musk.png
Paper+,Eau de Parfum,Commodity,dist/images/paper.png,"An Iso E Super with personality, Paper+ is an earthy and robust rendition. The combination of earthy Vetiver, wet Woods, and Iso E Super is unmistakable and reminiscent of mossy woods after rain.

We began with Paper Expressive: a sheer and crisp woody blend of Sandalwood and Iso E Super.We then made this crisp composition sweeter and softer with a molecular Amber opening for a Personal rendition. We also made an earthy, Bold rendition where Vetiver and wet woods cling to the skin.",dist/image/notes/sandalwood.png,dist/image/notes/amber.png,dist/image/notes/vetiver.png
Phantom,Eau de Toilette,Paco Rabanne,dist/images/phantom.png,"Step into the Paco Galaxy and join an intergalactic party where everyone is invited. Where you can be whoever you want to be. No matter who you are. No matter which planet you come from. The essence of self-confidence fueled by feel good energies. A futuristic aromatic fragrance born from the clash between luxury craftmanship and new-tech.Using a cutting-edge creative process to select ingredients to make you feel energized, powerfully confident and sexy. A bold scent with notes of addictive creamy lavender, fusing energizing lemon and sexy woody vanilla.

Radically different, totally disruptive: PHANTOM is our first connected bottle ever. Tap your phone on its top, and take off with your new wingman! A bold invitation to step outside the ordinary and celebrate life. 1000% feel-good. 1000% Paco Rabanne.",dist/images/notes/lavender.png,dist/images/notes/lemon.png,dist/images/notes/vetiver.png
Seahorse,Eau de Parfum,Zoologist Perfumes,dist/images/seahorse.png,"Balmy sunlight trips across foamy turquoise waves, sending rippling haloes onto the coral below. On the lagoon floor, anemone and seaweed sway in unison, limbs pumping to the rhythm of the current. Hovering among the coral branches, a group of seahorses gazes shyly on. The pulsating beat calls to them and two pair off, their tails entwined in a delicate waltz. Soon their passion is spent, but the memory of the dance lives on. For the pouch of the male seahorse tenderly cradles a precious clutch of eggs.

Zoologist Seahorse invites you to wade through a vibrant coral garden. This unisex scent turns expectation on its head. With such surprising couplets as tuberose and seaweed, sage and neroli, and fennel and vetiver, this delightful melody will sweep you away on a wave of joy and abandon.",dist/images/notes/cardamom.png,dist/images/notes/algae.png,dist/images/notes/vanilla.png
She Was an Anomaly,Eau de Parfum,Etat Libre d'Orange,dist/images/she-was-an-anomaly.png,"A singularity. A difference. A woman you will simply never understand. This perfume was necessary. A subtle yet unique blend of iris, enveloped by musk and sandalwood.

",dist/image/notes/cedarwood.png,dist/image/notes/vanilla.png,dist/image/notes/musk.png
